Volume	Issue	Year	Title	Subcategory	Author(s)
12	28	2000	Конвенция ООН в действии	Говорит КАРАТ-коалиция	Регина Индшева
12	28	2000	Региональные рекомендации КАРАТ-коалиции по выполнению пекинской "Платформы действий"	Говорит КАРАТ-коалиция	Бильяна Бийелич
12	28	2000	Материалы дискуссий сессии подготовительного комитета по проверке выполнения пекинской "Платформы действий"	Говорит КАРАТ-коалиция	Женовева Тишева, Александра Солик, Томка Дилевска, Дина Логин
12	28	2000	Восточная Европа и международные агентства	Говорит КАРАТ-коалиция	Павлина Филипова, Марша Гринберг
12	28	2000	Политическое заявление КАРАТ-коалиции и ряда НПО региона Центральной и Восточной Европы	Документ	
12	28	2000	Уроки музыки. Он и она	Мелочи жизни	Элен Чансиз
13	29	2000	Круги на воде	Литература, гендер, цензура	Мередит Такс
13	29	2000	Голоса женщин и новый европейский порядок	Литература, гендер, цензура	Надежда Ажгихина
13	29	2000	Цензура в Югославии: личный опыт	Литература, гендер, цензура	Светлана Слапшак
13	29	2000	Положение женщин-писательниц в Албании	Литература, гендер, цензура	Диана Чули
13	29	2000	Цензура в отношении женщин в Италии	Литература, гендер, цензура	Луиза Пассерини, Аннамария Тальявини
13	29	2000	Женщина как объект и субъект в современной российской литературе	Литература, гендер, цензура	Надежда Ажгихина
13	29	2000	Радуга женского движения	Журнал в журнале: Челябинская область	Татьяна Калинина
13	29	2000	История женского движения Челябинской области в областной прессе	Журнал в журнале: Челябинская область	Татьяна Калинина
13	29	2000	Госпожа удача	Журнал в журнале: Челябинская область	Татьяна Калинина
13	29	2000	Человек на своем месте	Журнал в журнале: Челябинская область	Татьяна Калинина
13	29	2000	Дорога длиной в тридцать восемь лет	Журнал в журнале: Челябинская область	Нина Терентьева
13	29	2000	Беспокойный характер	Журнал в журнале: Челябинская область	Татьяна Еги
13	29	2000	Послесловие к успеху	Журнал в журнале: Челябинская область	Лариса Луканина
13	29	2000	О деловых женщинах Миасса	Журнал в журнале: Челябинская область	Татьяна Калинина
13	29	2000	Вчера, сегодня и всегда	Журнал в журнале: Челябинская область	Татьяна Калинина
13	29	2000	Мужчины "прозревают" и... начинают помогать	Журнал в журнале: Челябинская область	Ольга Казачкова
13	29	2000	10 лет "Фемины"	Практика	Надежда Ажгихина
13	29	2000	В Форосе завершила работу 4-я Международная школа по исследованию жизни женщин	Практика	Надежда Ажгихина
15	31	2001	Демократия минус женщины – не демократия	История	Ольга Воронина, Елена Кочкина, Лариса Федорова, Наталья Абубикирова
15	31	2001	Воспоминания о Дубне	История	Колетт Шульман
15	31	2001	Возможно ли партнерство между женщинами...?	История	Наталья Бабич
15	31	2001	Вопросы гендерной терминологии и гендерная грамотность	Теория	Алла Денисова, Галина Гришина
15	31	2001	Женская доля в современной Грузии	Практика: СНГ	Ия Мерквиладзе
15	31	2001	Женщины Беларуси в зеркале истории	Практика: СНГ	Валентина Ковтун
15	31	2001	"САБР" против насилия	Практика: СНГ	Мавлюда Ширинова
15	31	2001	Охота за невестой	Практика: СНГ	Аймура Урустемова
15	31	2001	"Ну где я буду носить эти красные туфли?.."	Практика: СНГ	Александр Ярков
15	31	2001	Вторая жена – существо без прав и без голоса	Практика: СНГ	Лидия Исамова
15	31	2001	А кто такой гендер?	Практика: СНГ	Марина Усолкина
15	31	2001	Новые амазонки изящной словесности	Культура	Надежда Ажгихина
15	31	2001	Между Василисой Премудрой и Бабой Ягой: что стоит на пути развития феминистского самосознания в России	Диагноз	Наталья Иванова
15	31	2001	Как я открыла Россию в 2000 году (путевые заметки и фотографии)	Вкладка	Диана Дэвис
16	32	2002	Татьяна Ярыгина: "Только баланс между женским и мужским взглядом на мир может обеспечить его гармонию"	Позиция	Ирина Рыльникова
16	32	2002	Нино Бурджанадзе: "Я открыта для диалога с женским движением"	Позиция	Галина Петриашвили
16	32	2002	Галина Климантова: "Важно дать оценку предыдущему опыту"	Позиция	Вера Иванова
16	32	2002	Исповедь районного депутата	Позиция	Татьяна Федяева
16	32	2002	Уроки Армении: прежде и теперь	Опыт	Джемма Асратян
16	32	2002	Аналитики и практики	Опыт	Наталья Красавцева
16	32	2002	Как Вовочка с последней парты	Опыт	Ирина Мардарь
16	32	2002	Преодолевая стереотипы	Опыт	Наталья Старцева
16	32	2002	В пространстве любви...	Опыт	Татьяна Степанова
16	32	2002	Воительницы ЗАТО	Опыт	Александра Федорова
16	32	2002	Консорциум не сдается	Партнерство	Татьяна Дина
16	32	2002	И городу, и миру	Партнерство	Марина Дмитриева
16	32	2002	Иду на выборы!	Между делом	Галина Скороходова
17	33	2002	Гендерная цензура как элемент культуры	Ситуация	Ольга Липовская
17	33	2002	Блеск и нищета авиатрисс	Ситуация	Татьяна Федяева
17	33	2002	В плену архаичных традиций	Ситуация	Марфуа Тохтоходжаева
17	33	2002	Немного статистики в холодной воде рассуждений	Ситуация	Муяссар Максудова
17	33	2002	Женские голоса в грузинской культуре	Ситуация	Вера Церетели
17	33	2002	Вологодские истории	Ситуация	Галина Щекина
17	33	2002	Чтоб не пропасть по одиночке	Опыт преодоления	Надежда Ажгихина, Ирина Юрна
17	33	2002	Новые кадры решают все	Опыт преодоления	Наталия Скворцова
17	33	2002	С надеждой в будущее	Опыт преодоления	Венера Мусина
17	33	2002	"Афина" против стереотипов	Опыт преодоления	Нина Курасова
17	33	2002	Мурманская ассоциация журналисток: наш опыт на рынке труда	Опыт преодоления	Надежда Хлебникова
17	33	2002	Гендерное равенство в журналистике	Документы	
17	33	2002	Женщина в редакции	Документы	
19	35	2002	На пути к человеческой безопасности	Главная тема: глобализация	Колетт Шульман
19	35	2002	За глобализацию прав женщин в процессах развития	Документы	
19	35	2002	"Мы должны убрать эту боль, мы не можем оставить ее детям..."	Практика	Галина Петриашвили
19	35	2002	Где "Ангара" берет начало	Практика	Ирина Шарова
19	35	2002	Форум на Байкале	Практика	Ирина Шарова
19	35	2002	Воспоминания о Дубне	Практика	Ольга Липовская
19	35	2002	Основные подходы к разработке стратегий гендерного развития России	Инициатива	Татьяна Мельникова
19	35	2002	Глобализация экономики и передел рынка труда: гендерный аспект	Экономика	Людмила Ржаницына
19	35	2002	Интернет-знакомства сейчас опасны	Проба пера	Оксана Трухан
19	35	2002	Кто-то на сером ослике	Проба пера	Екатерина Макаркова
19	35	2002	Слабый пол	Проба пера	Марина Алёшина
19	35	2002	Словарь гендерных терминов	Книжный шкаф	
19	35	2002	О сильном и слабом поле	Книжный шкаф	Алина Ильина
19	35	2002	"Брызги шампанского" в ЦДЖ	Книжный шкаф	Элеонора Ивлева
20	36	2003	Пора осознать серьезность этой проблемы!	Оставим насилие вместе	
20	36	2003	Новая инициатива Международной амнистии	Оставим насилие вместе	Лора Гриффин
20	36	2003	"Белая лента" в Алтайском крае	Оставим насилие вместе	Максим Костенко, Светлана Саклакова
20	36	2003	Подарить свою энергию женщинам	Оставим насилие вместе	Ева Энслер
20	36	2003	В паутине жестокости	Оставим насилие вместе	Дебора Сонтаг
20	36	2003	Сексизм non stop?	Язык вражды	Алина Ильина, Ольга Липовская
20	36	2003	Язык вражды в российских СМИ: гендерное измерение	Язык вражды	Алла Денисова
20	36	2003	Бурла Хатун в зеркале азербайджанской независимости	Язык вражды	Мила Фараджуллаева
20	36	2003	Гендерные стереотипы в белорусской печати	Язык вражды	Наталья Кулинка
20	36	2003	Детство. Отрочество. Фотография...	Светотень	Умида Ахмедова
22	38	2003	Воспитательный потенциал семьи	Семья в зеркале перемен	Ольга Волжина
22	38	2003	Положение детей и качество человеческого потенциала России	Чужих детей не бывает	Наталья Римашевская
22	38	2003	Социализация детей, оставшихся без попечения родителей, на территории Самарской области	Чужих детей не бывает	Т.Н. Штейн, Т.Ю. Климешова
22	38	2003	План действий неправительственных организаций по профилактике и снижению масштабов детской беспризорности, безнадзорности и социального сиротства	Чужих детей не бывает	
22	38	2003	Арт-терапия – это здорово!	Чужих детей не бывает	Эмили Мерц
22	38	2003	"Женским инновационным проектам" – 10 лет!	Практика	
22	38	2003	Мы разные, но – равные	Практика	Галина Петриашвили
22	38	2003	Радиация дискриминации	Практика	Татьяна Федяева
22	38	2003	Поездка в Америку	Практика	Оксана Иванина
22	38	2003	(интервью с Мариной Табукашвили)	Практика	Галина Петриашвили
23	39	2003	Родительство в современной Америке (выдержки из отчета)	Семья в зеркале перемен	
23	39	2003	Американская мечта	Семья в зеркале перемен	Татьяна Федяева
23	39	2003	Неженатый папа	Семья в зеркале перемен	Светлана Пономарева
23	39	2003	Птица Феникс Адриенн Кларксон. Генерал-губернатор Канады и ее супруг – звездная пара нового типа	Семья в зеркале перемен	Надежда Ажгихина
23	39	2003	Отцовство и повседневность современного мужчины: единство или борьба?	Семья в зеркале перемен	Максим Костенко
23	39	2003	Резолюция краевой встречи отцов-руководителей общественных объединений, творческих коллективов, клубов	Семья в зеркале перемен	
23	39	2003	Президент конфедерации деловых женщин России о гендерной стратегии РФ и не только о ней (интервью с Лидией Блохиной)	Практика	Алина Ильина, Лидия Блохина
23	39	2003	Русские женщины на страницах скандинавских газет	Практика	Александра Леонтьева, Карин Сарсенов
23	39	2003	На российском западе женское большинство живет по законам мужского меньшинства	Практика	Ирина Герциг, Ольга Новосад
23	39	2003	Влюбленные в небо	История	Валентина Полетаева
23	39	2003	О российском женском движении: размышления над прочитанным	Книжный шкаф	Надежда Шведова
24	40	2003	Демократия минус женщина	Политика	
24	40	2003	Дестабилизация политических предписаний полу	Политика	Елена Кочкина, Михаил Кириченко, Наталья Степанова
24	40	2003	Мир станет настолько прекрасен, насколько может быть...	Политика	Татьяна Федяева
24	40	2003	О женском политическом полу – сознательном	Политика	Любовь Штылева
24	40	2003	Очарованье старых вымыслов или о гендерных стереотипах в политике	Политика	Татьяна Попова
24	40	2003	Женщин в мужчинах-политиках интересует...	Политика	Тамара Овнатанян
24	40	2003	И милость к падшим призывать...	Практика	Татьяна Степанова
24	40	2003	Толкователи женских судеб	СМИ	Мария Петроченкова
24	40	2003	Глянцевые журналы для женщин: между "бархатным феминизмом" и "жестким гламуром"?	СМИ	Любовь Горяева
24	40	2003	Женская тематика в СМИ Таджикистана	СМИ	Холема Хушкадамова
25	41	2004	Размышления	Предварительные итоги	Колетт Шульман
25	41	2004	Поверх барьеров	Предварительные итоги	Надежда Ажгихина
25	41	2004	Мысли под юбилейные фанфары	Предварительные итоги	Ольга Липовская
25	41	2004	Гендерное десятилетие: критический опыт осмысления	Предварительные итоги	Наталья В. Иванова
25	41	2004	Важно не останавливаться на достигнутом	Политика	Светлана Айвазова
25	41	2004	Политика – женское дело!	Политика	Ия Мерквиладзе
25	41	2004	Революция Роз	Политика	Галина Петриашвили
25	41	2004	Создается новое информационное пространство Евразии	Политика	Светлана Ризаева
25	41	2004	Школьные корни гендерного неравенства российской политики	Политика	Любовь Штылева
25	41	2004	"Мы пытаемся строить мир в душах людей..."	Практика	Тамара Овнатанян, лидеры Армении
25	41	2004	Наперекор нищете и нужде	Практика	Халима Хушкадамова
25	41	2004	Стихи разных лет	Творчество	Александра Смит
25	41	2004	Старые сказки на новый лад или гендерные аспекты мифологии	Творчество	Татьяна Попова
