Volume	Issue	Year	Title	Subcategory	Author(s)
1	13	1997	Предисловие к новому изданию		Колетт Шульман, Надежда Ажгихина
1	13	1997	Нам пишут...	Нам пишут...	Линда Бах, Марион Чамберлен, Мартина Ванденберг, Марина Либоракина, Елена Кочкина, Любовь Штылева
1	13	1997	Как живут женщины в Америке?	Год после Пекина	Колетт Шульман
1	13	1997	А кони все скачут и скачут...	Год после Пекина	Надежда Ажгихина
1	13	1997	Права женщин: реальность и перспективы	Год после Пекина	Надежда Кузнецова
1	13	1997	"Зазеркалье" гендерных стереотипов	Психология	Елена Мещеркина
1	13	1997	"Теперь я пишу прозу..."	Стадии женской жизни	Мария Арбатова, Павел Мирошник
1	13	1997	В поисках нового сценария	Стадии женской жизни	Джил Кер Конуэй
1	13	1997	Журналистки против стереотипов	Масс-Медиа	
1	13	1997	Женщины-журналистки во всем мире	Масс-Медиа	Анн Лагерстром
1	13	1997	Норвежская история о том, почему "стеклянный потолок" все еще не пускает женщин на верхние этажи газетной индустрии	Масс-Медиа	Элизабет Висли
1	13	1997	Женский вопрос и стереотипы в средствах массовой информации	Масс-Медиа	Мег Хогарт
1	13	1997	За жизнь без войн и насилия	Конференции	Валентина Череватенко
2	14	1997	Хартия женской солидарности		
2	14	1997	Сандра Айшем Вриланд – свет превыше смерти	СПИД/AIDS	Алида Брилл
2	14	1997	Беда, от которой никто не застрахован	СПИД/AIDS	Ирина Савельева
2	14	1997	Из российского опыта	Планирование семьи	Наталья Кигай
2	14	1997	Последствия антиабортного закона в Польше	Планирование семьи	Ванда Новицка
2	14	1997	Нет ответственности без свободы Интервью с владыкой Хризостомом	Планирование семьи	Андрей Попов, Алина Жвенклене
2	14	1997	Когда мужчины будут беременеть	Планирование семьи	Колетт Шульман
2	14	1997	Образы женщин в прессе Приморья	Масс-Медиа	Светлана Костенко
2	14	1997	Руководят, как всегда, мужчины	Масс-Медиа	Наталья Чеснокова
2	14	1997	Мир нашему дому	Масс-Медиа	Нана Ломидзе
2	14	1997	Защитница традиционных ценностей	Масс-Медиа	Марина Евграшина
2	18	1997	Опыт США: Шаг за шагом	Гендерное образование	Мариам Чамберлен
2	18	1997	Воспринимать студенток всерьез	Гендерное образование	Адриенн Рич
2	18	1997	Новая тема для диссертации	Гендерное образование	Круглый стол
2	18	1997	Женщины за жизнь без войн и насилия	Практика	Галина Скороходова
2	18	1997	Помогая себе и друг другу: совладание с травмой	Психология	Виктор и Ирина Каган
2	18	1997	Гендерный аспект в творчестве московских художниц 80–90-х годов	Культура	Анна Альчук
2	18	1997	Из Карелии с любовью	Журнал в журнале: Карелия	Лариса Бойченко
2	18	1997	Республика Карелия	Журнал в журнале: Карелия	Наталья Красавцева
2	18	1997	Нужно поверить в себе	Журнал в журнале: Карелия	Интервью Л.Бойченко
2	18	1997	"Жизнь прошла как в сказке"	Журнал в журнале: Карелия	Интервью Л.Бойченко
2	18	1997	Офицерские жены	Журнал в журнале: Карелия	Наталья Красавцева
2	18	1997	Карелия – Вермонт	Журнал в журнале: Карелия	Валентина Хотеева
2	18	1997	Дети Солнцевой	Журнал в журнале: Карелия	Юлия Утышева
2	18	1997	Петрозаводский клуб ищущих работу	Журнал в журнале: Карелия	Антонина Кябелева
2	18	1997	К Ирине свет Андреевне	Журнал в журнале: Карелия	Наталья Красавцева
2	18	1997	Русалочка	Журнал в журнале: Карелия	Ольга Голубева
2	18	1997	Свободный полет	Спорт	Валентина Казакова
2	18	1997	Радость победы	Спорт	Коллин Маккуилен
2	18	1997	Мой любимый спорт	Спорт	Хизер Джонс
2	18	1997	Лошадь в городе	Мелочи жизни	Светлана Бестужева-Лада
3	15	1997	Реформа вооруженных сил без участия женщин невозможна	Женщина и армия	Марина Добровольская
3	15	1997	Моя военная карьера	Женщина и армия	Глория Даффи
3	15	1997	Это касается и нас: женщины в вооруженных силах США	Женщина и армия	Колетт Шульман
3	15	1997	Уникальный супруг	Идеальный муж	Синтия Маккей
3	15	1997	Мы по-прежнему любим друг друга	Идеальный муж	Сьюзан Моргентау
3	15	1997	Загнанная в угол	Идеальный муж	
3	15	1997	Достоин восхищения	Идеальный муж	Эллен Швамм Бродки
3	15	1997	На безрыбье и рак рыба	Идеальный муж	Эми Хемпел
3	15	1997	Сделает ли российская женщина счастливым своего мужа	Идеальная жена	Мария Котовская, Наталья Шалытина, Мария Золотухина
3	15	1997	Российско-американские браки: притяжение противоположностей	Идеальная жена	Линн Виссон
3	15	1997	Русский муж – это особая привилегия	Идеальная жена	Надежда Ажгихина
3	15	1997	Жанна, Джон и девушка из бара	Идеальная жена	Надежда Ажгихина
3	15	1997	У точности дефиниций или шипы и розы в телепередаче "Я сама"	Полемика	Ольга Линовская
3	15	1997	Льготы, квоты и гарантии по признаку пола	Проблемы	Елена Кочкина
3	15	1997	Буклет о власти	Практикум	
3	19	1998	Женщины в тюрьме	Женщина и неволя	Колетт Шульман
3	19	1998	Отверженные	Женщина и неволя	Надежда Ажгихина
3	19	1998	Открытая тюрьма. Что это такое?	Женщина и неволя	Светлана Свистунова
3	19	1998	Средь мордовских лесов затерялись...	Женщина и неволя	Татьяна Юрасова
3	19	1998	Созидающий диалог: свобода быть собой!	Гендерное образование	Зоя Хоткина
3	19	1998	Конгрессу женщин пять лет, что дальше?	Журнал в журнале: Кольский полуостров	Любовь Штылева
3	19	1998	Говорят лидеры Конгресса женщин Кольского полуострова	Журнал в журнале: Кольский полуостров	Любовь Штылева, Светлана Паршкова, Ирина Фогт
3	19	1998	Руководить – занятие не для слабонервных	Журнал в журнале: Кольский полуостров	Евгения Зимина
3	19	1998	"Арматор": дела идут в гору	Журнал в журнале: Кольский полуостров	Надежда Хлебникова
3	19	1998	Чтобы рос малыш здоровым	Журнал в журнале: Кольский полуостров	Евгения Зимина
3	19	1998	Экология и самочувствие горожан	Журнал в журнале: Кольский полуостров	Людмила Карху
3	19	1998	За частоколом побед	Журнал в журнале: Кольский полуостров	Людмила Карху
3	19	1998	Женщины могут	Журнал в журнале: Кольский полуостров	Людмила Карху
3	19	1998	Мамочка, любимая...	Журнал в журнале: Кольский полуостров	Евгения Зимина
3	19	1998	Наедине со стрессом (беседа вторая)	Психология	Виктор и Ирина Каган
3	19	1998	Женщины на дорогах	Мелочи жизни	Елена Черкасова
3	19	1998	Пропустите женщин и детей!	Искусство	Ката Поллит
4	16	1997	"Диалог: поле для трансформации"	Теория	Валтрауд Айланд
4	16	1997	Абсолютная посвященность делу	Женщина и бизнес	Колетт Шульман
4	16	1997	Путь к директорскому креслу	Женщина и бизнес	Колетт Шульман
4	16	1997	Верить в успех	Женщина и бизнес	Ида Шмерц
4	16	1997	Автономное плавание	Женщина и бизнес	Валентина Казакова
4	16	1997	Исцеление цветом	Женщина и бизнес	Надежда Ажгихина
4	16	1997	Настроена ли Европа против торговли женщинами	Проблема	Светлана Купряшкина
4	16	1997	Феминистский дискурс достиг высоты Жигулевского утеса	Практика	Ольга Воронина
4	16	1997	Обретение силы женщинами – поиск истинной демократии среди праха патриархальной риторики	Практика	Одри МакЛолин
4	16	1997	Сила слова	Культура	
4	16	1997	Один день ну очень среднестатической женщины или Откуда берутся стрессы?	Мелочи жизни	Елена Черкасова
4	20	1998	Как растить мальчиков?	Воспитание мальчиков	Колетт Шульман
4	20	1998	Я менялась вместе с ним	Воспитание мальчиков	Оля Черенцова
4	20	1998	Матери о сыновьях	Воспитание мальчиков	Колетт Шульман
4	20	1998	Взгляд со стороны	Воспитание мальчиков	Елена Чакириди
4	20	1998	Маргарет Сангер: У истоков движения за контроль рождаемости в Соединенных Штатах Америки	Здоровье	О.Б. Осколкова
4	20	1998	Алекс Сангер: наследник великого дела	Здоровье	Колетт Шульман
4	20	1998	Женский парламент – сообщество единомышленников	Журнал в журнале: Саратовская губерния	Анна Дунаевская
4	20	1998	Надя, Надина, Надежда	Журнал в журнале: Саратовская губерния	Анна Дунаевская
4	20	1998	Библиотечная легенда	Журнал в журнале: Саратовская губерния	Тамара Комиссарова
4	20	1998	Для детей нужно издавать как для взрослых. Только лучше	Журнал в журнале: Саратовская губерния	Валентина Юрьева
4	20	1998	Маленькая женщина в "мужском" бизнесе	Журнал в журнале: Саратовская губерния	Валентина Казакова
4	20	1998	Милицейский погон на женском плече	Журнал в журнале: Саратовская губерния	Валентина Казакова
4	20	1998	Нет проблем в обществе более незначительных, чем женские	Журнал в журнале: Саратовская губерния	Ирина Макарова
4	20	1998	Помогая другим (беседа третья)	Психология	Ирина и Виктор Каган
4	20	1998	Как я выходила замуж по американским рецептам	Мелочи жизни	Наталья Арт
7	23	1999	Гендерный разворот Всемирного банка	Глобальные проблемы	Елена Кочкина
7	23	1999	Женщины и новая инициатива по снижению долговой зависимости	Глобальные проблемы	Яссин Фолл
7	23	1999	Игры патриархов	Глобальные проблемы	Генри Холмс, Андрей Синельников
7	23	1999	Беседа с послом Джин Киркпатрик	Портрет	Николай Злобин
7	23	1999	Женское движение в Армении. Очерки истории и современность	Журнал в журнале: Республика Армения	Анаит Арутюнян
7	23	1999	Формирование культуры мира и демократии на пост-коммунистическом пространстве	Журнал в журнале: Республика Армения	Елена Вартанян
7	23	1999	Армянская женщина в политике: традиции и современность	Журнал в журнале: Республика Армения	Мариетта Саакян
7	23	1999	Мы от мужественности только страдаем	Журнал в журнале: Республика Армения	Джемма Асратян
7	23	1999	"Все отдавала всегда, много ли, мало – не знаю"	Журнал в журнале: Республика Армения	Валерия Захарян
7	23	1999	Роль женщин и женских организаций в становлении демократического, гражданского общества в Армении	Журнал в журнале: Республика Армения	В.Г. Осипов
7	23	1999	Уроки демократии: послесловие спустя полгода	Журнал в журнале: Республика Армения	Тамара Овнатанян
7	23	1999	Гендер – "вопль женщин всех времен"	Журнал в журнале: Республика Армения	Софья Бабаян
7	23	1999	"Армянка не имеет права быть сегодня слабой..."	Журнал в журнале: Республика Армения	Марина Григорян
7	23	1999	Современные американские журналы для женщин	Книжный шкаф	Барбара Фридман
8	24	1999	Обращение женщин к Гаагской мирной конференции "Призыв к миру"	Война	
8	24	1999	Всемирная культурная война	Война	Мередит Такс
8	24	1999	Религия и феминизм. Материалы круглого стола	Религии	Марсиа Джилспи, Мерилин Френч, Риффат Хассан, Хелен Ла-Келли Хант, Летти Коттин Погребин, Чанг Юнг Кьюнг, Фей Уотлтон, Ката Поллитт, Френсис Кисслинг, Денис Аккерман, Рабби Эти Левин, Терезия Хинга, Хелен Гуорков
8	24	1999	В поисках духовной опоры	Религии	Наталья Мандельбаум
8	24	1999	Непростые вопросы	Религии	Френсис Кисслинг
8	24	1999	Шаманизм: путь к исцелению	Религии	Ирина Кортен
8	24	1999	Каждую весну в Вильнюсе проходит Всемирный день молитвы христианок	Религии	Надежда Ажгихина
8	24	1999	"Лучше нее Шопена играл только Рихтер"	История	Надежда Ажгихина
8	24	1999	Женские журналы в России начала XX века	История	Екатерина Скобло
8	24	1999	Образ женщины-феминистки: монстр или незаурядная личность	Гендерные исследования	Людмила Бондаренко
8	24	1999	Участие женщин в общественно-политической жизни Республики Карелия	Практика	Л.Д. Бойченко, И.С. Синичкина
8	24	1999	ЕвроКвилтТур'99	Практика	
8	24	1999	Новости из Узбекистана	Практика	
8	24	1999	Провинциальный взгляд на глобальные проблемы	Мелочи жизни	Юлия Протасова
9	25	1999	Почему женщины должны идти в политику?	Политика	Надежда Шведова
9	25	1999	Женщина и религия?	Религии	Наталья Кигай
9	25	1999	Особенности религиозного сознания современной российской женщины	Религии	Мария Котовская
9	25	1999	"Образ из чувств моих..."	Религии	Марина Адамович
9	25	1999	Постфундаменталистский кошмар и российское "бабье царство"	Религии	Ольга Газизова
9	25	1999	Нужна ли религия современной женщине?	Религии	Татьяна Гусева
9	25	1999	Как я нашла свой путь домой	Религии	Талиба Джилани
9	25	1999	Интервью с Джан Убрах	Религии	Колетт Шульман
9	25	1999	Карин Бурстранд – женщина – пастор из Швеции	Религии	Надежда Хлебникова
9	25	1999	20 лет тому назад в Ленинграде зародилось женское движение	История	Анна Наталия Малаховская
9	25	1999	История создания независимого социального женского центра Псковской области	Журнал в журнале: Псковская губерния	Наталья Васильева
9	25	1999	Размышляя о нашей деревне	Журнал в журнале: Псковская губерния	
9	25	1999	На бедность души подайте	Журнал в журнале: Псковская губерния	Тамара Карнаухова
9	25	1999	От человека к человеку	Журнал в журнале: Псковская губерния	
11	27	2000	Я и кино	Юность – пора решений	Брук Уиттерс
11	27	2000	Просвещение – освобождение	Юность – пора решений	Сьюзен Эндрюс
11	27	2000	Вовлекать мужчин в борьбу с насилием	Юность – пора решений	София Куломзин
11	27	2000	Беседа с С.Куломзин	Юность – пора решений	Колетт Шульман
11	27	2000	Если бы я была мальчиком	Юность – пора решений	Анна Волкова
11	27	2000	Журналы для девушек – что это такое?	Юность – пора решений	Ольга Терентьева
11	27	2000	"Девочки просят внимание"	Юность – пора решений	Голоса участниц
11	27	2000	"Самое значимое увлечение в жизни"	Юность – пора решений	Оля Лучкова, Женя Ваганова, Рубина Закирова, Света Ваганова, Женя Кенарская, Елена Машкова
11	27	2000	Молодежь и трудоустройство	Юность – пора решений	Света Машкова
11	27	2000	Нельзя молчать	Юность – пора решений	Ирина Романенко
11	27	2000	Серьезный разговор: Молодежь и венерические заболевания	Юность – пора решений	Женя Кенарская
11	27	2000	Я приду к тебе на помощь	Юность – пора решений	Женя Кенарская
11	27	2000	Частушки в стиле DOOM-METAL	Юность – пора решений	Екатерина Косурова
11	27	2000	Проблемы взаимоотношений детей и родителей	Юность – пора решений	Света Ваганова
11	27	2000	Женщины в СМИ Центральной Азии	Журнал в журнале: Республика Кыргызстан	Аймира Урустемова
11	27	2000	"Женское движение Кыргызстана: история, традиции и современность"	Журнал в журнале: Республика Кыргызстан	Замира Белекова
11	27	2000	Гендерное неравенство в СМИ	Журнал в журнале: Республика Кыргызстан	Гульнара Ибраева
11	27	2000	"Я соскучилась по свету..."	Журнал в журнале: Республика Кыргызстан	Жумадин Кадыров
11	27	2000	12 дней в Баткене	Журнал в журнале: Республика Кыргызстан	Аймира Урустемова
11	27	2000	"Я занимаюсь любимым делом..."	Журнал в журнале: Республика Кыргызстан	Антонина Ли
11	27	2000	Итоги межрегионального фестиваля телепрограмм "Женская тема – 3"	Практика	
12	28	2000	Самая мирная революция	Женщины 2000	Надежда Ажгихина
12	28	2000	Говорят российские участницы	Женщины 2000	Галина Карелова, Екатерина Лахова, Валентина Броневич, Любовь Слиска, Наталья Бережная, Елена Машкова, Флюра Зиятдинова, Ольга Липовская, Людмила Завадская
12	28	2000	Будущее планеты зависит от женщин	Женщины 2000	Кофи Аннан
12	28	2000	Путь к конференции "Женщина-2000: Пекин + 5"	Женщины 2000	
12	28	2000	Юнифем приходит в страны Восточной Европы	Женщины 2000	Надежда Ажгихина
12	28	2000	Юнифем: забота о женщинах всего мира	Женщины 2000	
12	28	2000	"Наша работа далека от завершения"	Женщины 2000	Рауль Сингх
12	28	2000	Не позволить правительствам отступить от своих обязятельств	Женщины 2000	Рауль Сингх
12	28	2000	"Прогресс женщин мира" объединил художниц всех континентов	Выставка	Нолин Хейзер
12	28	2000	Новости женского рода	Практика	Надежда Ажгихина
12	28	2000	Африканки рвутся в бой	Практика	Наталья Крылова, Ирина Рыбалкина
12	28	2000	Что женщины недополучают от демократии в Центральной и Восточной Европе	Говорит КАРАТ-коалиция	Каталин Медведев
